R_1Pu6nM2d0YNWjkK,6296bef3248bf76cc113926b,ticket writer,casino,i print tickets at a sportsbook and its for a casino that shows sporting events on tv,1,1,3,"1,3,5,7,9",,,,2,,3,,5,,4,,1,,,,,,,3,,15,,10,,20,,10,,,,,,,26,,20,,36,,62,,39,,,,,,,77,,63,,62,,40,,86,,,,,,,69,75,65,none,finding stats to help bettors,"3,5,6,7,8",,,50,,10,20,10,10,,,,,,,,,,,,,,,,,,,,,,,,,,,,,looking at betting lines and statistics,"1,2,5,8,9",10,25,,,5,,,10,50,,,,,,,,,,,,,,,,,,,,,,,,,,,,solving problems that customers have,"2,9,10,11,15",,50,,,,,,,20,10,10,,,,10,,,,,,,,,,,,,,,,,,,,,,pressing on the screen to enter bets,"2,3,7,13,15",,20,20,,,,15,,,,,,30,,15,,,,,,,,,,,,,,,,,,,,,,giving people information to help win,"4,9,13,15,16",,,,50,,,,,20,,,,10,,10,10,,,,,,,,,,,,,,,,,,,,,,,,,,,,,,,,,,,,,,,,,,,,,,,,,,,,,,,,,,,,,,,,,,,,,,,,,,,,,,,,,,,,,,,,,,,,,,,,,,,,,,,,,,,,,,,,,,,,74,70,60,,40,64,23,13,to understand functions with ai,2,2,1,1,1,1
R_8qsY13azUbcKXws,62c612ea71b6cc890bd5ad41,Researcher,University,"As a cancer researcher, I am to study to identify how some immune cells protect some cancer cells for presentation and publication in scientific journals.",1,2,3,"1,4,6,7,9",,,,1,,,5,,2,3,,4,,,,,,,8,,,5,,8,13,,6,,,,,,,37,,,36,,53,99,,43,,,,,,,56,,,56,,60,63,,100,,,,,,,100,99,80,,Reading papers,"2,4,5,6,12",,30,,10,30,10,,,,,,20,,,,,,,,,,,,,,,,,,,,,,,,,,,,,,,,,,,,,,,,,,,,brainstorming,"1,8,11,14,15",10,,,,,,,50,,,10,,,20,10,,,,,,,,,,,,,,,,,,,,,,"Getting everything in place, preparing for the experiments.","1,5,7,10,16",20,,,,10,,30,,,10,,,,,,30,,Actually performing experiments in the lab.,"1,3,5,14,16",20,,20,,30,,,,,,,,,20,,10,,,,,,,,,,,,,,,,,,,,,"presenting findings from my work at scientific meetings. Also, writing and distributing academic writings to an audience qualify in this.","1,2,4,6,17",10,20,,10,,10,,,,,,,,,,,50,,,,,,,,,,,,,,,,,,,,,,,,,,,,,,,,,,,,,,,,,,,,,,,,,,,,,,,,,,,,,,,,,,,,,,,,,,,,,,,,,,,,,,,,,,,,,,,,,,,,,,,,,,,,,,,,,,,100,90,82,,69,55,30,31,Knowing essential skills for designing a robot for different job roles.,1,1,1,1,1,1
R_8H11TdjltQFRWKZ,5fea380c6d65c5a2c35295c7,Customer Service Representative,A medical device manufacturing company,My job title is CS Rep. My role includes receiving and screening orders from Distribution Partners and checking they have the required registration from their Ministry of Health (or equivalent) in the destination country. I am also responsible for processing Service Contracts for Global Service Contracts where customers request further support for their devices and training requirements. ,5,15,4,"3,6,8,9,12",,,,,,4,,,2,,3,1,,,5,,,,,,8,,,5,,12,8,,,6,,,,,,2,,,3,,3,3,,,3,,,,,,4,,,5,,6,31,,,4,,,,100,100,60,My job is not physical ,,,,,,,,,,,,,,,,,,,,,,,,,,,,,,,,,,,,,,,Sifting through usage records for device serial numbers,"1,2,5,8,17",20,20,,,20,,,20,,,,,,,,,20,,,,,,,,,,,,,,,,,,,,,,,,,,,,,,,,,,,,,,,Sorting out emails in order of priority. Moving between tasks ,"2,7,8,11,17",,5,,,,,40,35,,,5,,,,,,15,,,,,,,,,,,,,,,,,,,,Answering emails,"3,5,8,14,17",,,20,,20,,,20,,,,,,20,,,20,I let customers know the status of their orders and advise on service contracts to sales people (eg if contract expiration is imminent),"2,5,7,8,17",,14,,,12,,12,12,,,,,,,,,50,,,,,,,,,,,,,,,,,,,,,,,,,,,,,,,,,,,,,,,Adding supporting docs to files,"5,7,8,13,14",,,,,20,,15,15,,,,,15,35,,,,,,,,,,,,,,,,,,,,,,,,,,,,,,,,,,,,,,,,,,,,,,,,,,,,,,,,,,,,,68,100,67,na,100,100,18,0,Organising workload and the skills around this ,1,1,1,1,1,1
R_8oBAfx3FHlSsLNi,6679e8d8236c10548de94465,admin assistant,east kent nhs hospitals,"learning and development health and safety administrator for staff training needs, NHS, Healthcare non-clinical role",3,3,4,"3,6,9,10,11",,,,,,3,,,1,,,4,2,5,,,,,,,10,,,5,,,10,3,8,,,,,,,0,,,0,,,0,5,0,,,,,,,13,,,27,,,100,76,100,,,,,100,100,100,no feedback so far,,,,,,,,,,,,,,,,,,,,,,,,,,,,,,,,,,,,,,,Creating training compliance reports from large data sets and providing insights to present to key stakeholders.,"2,10,13,14,17",,10,,,,,,,,5,,,5,40,,,40,,,,,,,,,,,,,,,,,,,,,,,,,,,,,,,,,,,,,,,"Routine planning for the day each morning.
Short term planning for the weeks activities.
Long term planning for arrangement of events and sessions for the whole year","2,4,7,8,13",,20,,30,,,10,30,,,,,10,,,,,,,,,,,,,,,,,,,,,,,,,,,,,,,,,,,,,,,,,,,"Providing accurate and detailed information to key stakeholders about training compliance figures and explaining the insights i have made.

Ensuring staff have all the relevant information to attend scheduled training classes and they understand their responsibilities.

","10,11,13,15,17",,,,,,,,,,5,5,,13,,27,,50,Developing relationships with external training providers and other internal departments to work well together.,"10,11,14,15,17",,,,,,,,,,10,20,,,10,10,,50,"Training of departments in the use of bespoke software for the recording of training data.
Training new starters to the department on how to fulfil the requirements of their role.","3,9,10,11,17",,,10,,,,,,10,10,30,,,,,,40,,,,,,,,,,,,,,,,,,,,,,,,,,,,,,,,,,,,,,,,,,,,,,,,,,,,,,,,,,,,,,,,,,,,,,,,,,,,,85,100,100,well constructed,100,100,46,61,If I didnt know i would think it was about how to program ai to better serve different roles and functions in society.,1,1,1,1,1,1
R_2iZtqQf6ZLSKyUF,665afcd09f26520c4307ebcf,Business Analyst,Housing,"I work for a housing company that provides social housing to the public. I sit in a team that is involved with I.T change within the business. My role is to be the go between, between the business and I.T. I understand the business requirements and process, document these in a coherent way and deliver the functionality through change.",2,4,4,"1,8,9,10,12",,,,2,,,,,,,5,1,3,,4,,,,20,,,,,,,40,50,40,,10,,,,0,,,,,,,8,0,0,,6,,,,73,,,,,,,11,100,100,,10,,,,90,90,70,There could be more options in regards to tasks that are completed.,Find out detail information about business procedures and requirements. Find information about the technology and its functionality. ,"3,5,11,14,17",,,15,,20,,,,,,5,,,20,,,40,,,,,,,,,,,,,,,,,,,,,,,,,,,,,,,,,,,,,,,,,,,,,,,,,,,,,,,,,,,,,,,,,,,,,,,,,,,,,,,,,,,,,,,,,,,,,,,,,,,,,,,,,,,,,,,,,,,I use computers on a day to day basis to perform all my tasks.,"3,4,5,7,14",,,30,20,20,,20,,,,,,,10,,,,Communicate business requirements to potential vendors. Communicate tech functionality back to the business. communicate tasks from data teams to the business. Communicate tasks to training teams.,"2,4,5,6,17",,10,,5,10,5,,,,,,,,,,,70,I work with a variety of teams and areas within the business. I have to gather requirements and information from these teams in order to successfully implement new technology. By building strong relations the speed and efficient I can implement a project is much quicker.,"7,10,12,15,17",,,,,,,10,,,20,,10,,,20,,40,,,,,,,,,,,,,,,,,,,,"I have to document business processes, business requirements, business cases, options appraisals, benefit analysis documentation.","1,2,3,4,5",20,40,10,10,20,,,,,,,,,,,,,,,,,,,,,,,,,,,,,,,,,,,,,,,,,,,,,,,,,,,,,,,,,,,,,,,,,,,,,,80,90,75,No further additions,50,49,20,19,Main abilities and attributes used in the workplace between physical and non physical vocations.,2,1,1,1,1,1
R_8q2eVQxfwKQiNua,63a7036757c246aaa3ad90f5,Director,AJM Inventories,Sole director of a small business.  AJM Inventories is a home based business using self employed clerks to carry out tasks.  We provide inventory services to agents & private landlords.,17,17,4,"2,4,5,6,8",,,,,5,,4,3,1,,2,,,,,,,,,10,,5,5,10,,15,,,,,,,,,0,,0,0,1,,0,,,,,,,,,15,,51,31,60,,10,,,,,,,,100,100,100,Very easy to navigate & understand for my type of business,,,,,,,,,,,,,,,,,,,,Reading clerks' reports to ensure the detail is accurate & sufficient information supplied,"2,5,7,9,13",,20,,,20,,20,,20,,,,20,,,,,,,,,,,,,,,,,,,,,,,,Implementing a new marketing plan which demonstrates the changes made to the business in order to keep up with technology,"2,4,7,8,9",,20,,20,,,20,20,20,,,,,,,,,Deciding which clerk is most experienced to carry out the task in hand.  Dealing with queries from agents if there is a query on a report that has been submitted.,"5,6,10,14,15",,,,,20,15,,,,20,,,,15,30,,,"Allocating jobs to clerks when agents make a booking, organising clerks diary.","2,6,7,8,16",,25,,,,15,15,25,,,,,,,,20,,,,,,,,,,,,,,,,,,,,,"As a director of a small business the majority of my tasks are carried out on a computer e.g. accounts, marketing, allocation of work, emails etc","3,4,5,6,7",,,20,15,35,15,15,,,,,,,,,,,,,,,,,,,,,,,,,,,,,,,,,,,,,,,,,,,,,,,,,,,,,,,,,,,,,,,,,,,,,,,,,,,,,,,,,,,,,,,,,,,,,,,,,,,,,,,,,,,,,,,,,,,,,,,,,,,,,,,,,,,,,,,,,,,,,,,,70,100,90,"No, easy to navigate",20,20,9,9,Cognitive behaviour in the work place,1,3,3,2,1,1
R_4ixFUaIKC9Vwlq1,5e85f09aef7ca6023f447da5,Case Manager,ACC,I work as a case manager for a government agency that supports people while they are off work because of an injury caused by an accident.,0,0,4,"1,5,6,8,9",,,,1,,,,2,4,,5,3,,,,,,,8,,,,4,2,,8,4,,,,,,,1,,,,1,1,,1,1,,,,,,,100,,,,2,8,,1,100,,,,,,,99,100,90,,"I have to see what kind of support my clients need, and assess their eligibility","1,3,7,10,11",20,,20,,,,20,,,20,20,,,,,,,,,,,,,,,,,,,,,,,,,,,,,,,,,,,,,,,,,,,,,,,,,,,,,,,,,,,,,,,,"I have to make decisions on supports available for clients, and whether we can cover their injuries","5,8,11,13,15",,,,,20,,,30,,,30,,10,,10,,,Triaging what the most important tasks I have that day are,"1,3,7,8,15",20,,20,,,,20,20,,,,,,,20,,,,,,,,,,,,,,,,,,,,,,"My whole job is on the computer. It's how I collect info, record info, set up supports for people","1,7,10,14,17",10,,,,,,30,,,20,,,,20,,,20,I have to talk to clients all day,"3,10,11,14,17",,,20,,,,,,,25,20,,,5,,,30,,,,,,,,,,,,,,,,,,,,,,,,,,,,,,,,,,,,,,,,,,,,,,,,,,,,,,,,,,,,,,,,,,,,,,,,,,,,,,,,,,,,,,,,,,,,,,,,,,,,,,,,,,,,,,,,,,,87,100,99,,5,5,41,41,Understanding what's needed for different jobs,1,1,1,1,1,1
R_8WPhpmdxCsuGmIE,6656495422994168f9068c07,Associate,AIB,"I work analysing corporate lending opportunities for a bank, operating within the European market. ",6,10,4,"1,2,3,5,9",,,,5,2,1,,3,,,,4,,,,,,,10,5,15,,10,,,,5,,,,,,,0,0,0,,0,,,,0,,,,,,,60,80,40,,80,,,,100,,,,,,,70,89,60,No specific feedback so far. ,Sourcing information or reviewing information provided to pick out relevant aspects. ,"2,3,5,7,17",,20,20,,20,,20,,,,,,,,,,20,Assessing business performance or plans. ,"2,5,8,13,15",,10,,,10,,,40,,,,,15,,25,,,Taking information about a company (financial or otherwise) and assessing what it means for current and future performance. ,"2,5,7,8,13",,35,,,25,,10,10,,,,,20,,,,,,,,,,,,,,,,,,,,,,,,Evaluating information and deciding the appropriate course of action. ,"2,5,8,13,17",,25,,,35,,,25,,,,,10,,,,5,,,,,,,,,,,,,,,,,,,,,,,,,,,,,,,,,,,,,,,,,,,,,,,,,,,,,,,,,,"Writing reports or papers for others detailing output, factual information, or opinions on a business, as well as verbally engaging and explaining business recommendation. ","2,5,7,15,17",,20,,,25,,10,,,,,,,,5,,40,,,,,,,,,,,,,,,,,,,,,,,,,,,,,,,,,,,,,,,,,,,,,,,,,,,,,,,,,,,,,,,,,,,,,,,,,,,,,,,,,,,,,,,,,,,,,,,,,,,,,,,,,,,,,,,,,,,80,100,79,No advice on improvement. ,70,70,60,70,How replaceable the job was by robots. ,1,1,1,1,1,1
R_3QrIfgR0HIwxOt0,66aa58ac3ce89509dd695415,Co-op Student Engineer,Owens Corning,"My job is to work on the smaller tasks in a bigger project, usually related to machinery failure. Mu organization is an insulation production plant and we belong in the manufacturing industry.",0,0,4,"1,5,7,8,9",,,,2,,,,3,,5,1,4,,,,,,,9,,,,8,,1,20,2,,,,,,,0,,,,0,,50,0,0,,,,,,,80,,,,65,,20,0,100,,,,,,,100,100,100,It was nice and descriptive. I was able to analyze my job objectively.,"Communicating with others and retrieving said information, looking for that information online, and analyzing situations or objects to derive information.","2,5,7,11,17",,30,,,20,,20,,,,15,,,,,,15,,,,,,,,,,,,,,,,,,,,,,,,,,,,,,,,,,,,,,,,,,,,,,,,,,,,,,,,,,"Analyzing information and giving feedback, classifying information based on relevance, and identifying problems based on available data.","2,5,10,11,17",,30,,,30,,,,,15,20,,,,,,5,,,,,,,,,,,,,,,,,,,,"Going to places and looking at objects, moving or shifting objects.","2,3,4,7,16",,10,10,30,,,20,,,,,,,,,30,,"using software to draw machinery blueprints, communicate with others, and learn new information.","3,4,7,14,17",,,30,20,,,10,,,,,,,30,,,10,"Telling others about the information I found to others, giving feedback, and asking for more information by giving some as context.","1,5,10,11,17",10,,,,15,,,,,15,20,,,,,,40,,,,,,,,,,,,,,,,,,,,,,,,,,,,,,,,,,,,,,,,,,,,,,,,,,,,,,,,,,,,,,,,,,,,,,,,,,,,,,,,,,,,,,,,,,,,,,,,,,,,,,,,,,,,,,,,,,,100,100,100,I think it covered all bases.,60,65,0,0,I would think it is about designing a robot for specific purposes and finding out what people consider to need the most while performing said tasks.,3,1,1,1,1,1
R_1qag3zt27XQhlMz,565096a1d034af00056cee28,Distribution Manager,GL Foods,"I am in charge of the distribution of finished goods from the sites that produce product. We are in food manufacturing, processing all kinds of dairy products.",0,16,4,"1,3,5,6,11",,,,4,,5,,2,3,,,,,1,,,,,5,,5,,15,5,,,,,10,,,,,0,,0,,0,0,,,,,0,,,,,70,,16,,65,60,,,,,100,,,,,100,90,70,"Mostly applicable, but no option for 'management' under the job types.","If there was an incident that took place with little information, how I would go about investigating it.","1,9,13,14,15",20,,,,,,,,15,,,,20,10,35,,,,,,,,,,,,,,,,,,,,,,"I was thinking about analyzing our quarterly budget and entering, adjusting and removing data as needed.","3,5,8,11,15",,,20,,30,,,20,,,10,,,,20,,,,,,,,,,,,,,,,,,,,,,I was thinking about a customer concern where they wanted a specific service and how we would go about implementing that.,"3,8,13,14,15",,,10,,,,,30,,,,,25,10,25,,,I was thinking about making a priority list for my supervisors. Goals and objectives that needed to be met.,"8,10,11,15,17",,,,,,,,30,,15,15,,,,15,,25,,,,,,,,,,,,,,,,,,,,,,,,,,,,,,,,,,,,,,,,,,,,,,,,,,,,,,,,,,,,,,,,,,,,,,,,,,,,,Giving performance evaluations. Training subordinates on a new task.,"3,5,8,11,17",,,15,,20,,,10,,,15,,,,,,40,,,,,,,,,,,,,,,,,,,,,,,,,,,,,,,,,,,,,,,,,,,,,,,,,,,,,,,,,,,,,,,,,,,,,,,,,,,,,100,90,90,,70,80,20,15,I would have thought it was about measuring someone's level of self-awareness.,2,1,1,1,1,1
R_8dA1lXQEl2rQDa7,669627dafd0c7bf244e386d3,Supplier Compliance Coordinator,Group Lotus,"Automotive manufacturing field building sports cars. My job is part of a wider compliance team mitigating risk to the production line by ensuring suppliers are compliant with company guidelines. This encompasses many areas such as finance, packaging, labelling, quantities and more.",0,4,4,"1,5,8,9,10",,,,3,,,,1,,,5,2,4,,,,,,6,,,,6,,,12,4,6,,,,,,20,,,,0,,,50,40,40,,,,,,80,,,,60,,,60,60,100,,,,,,90,100,90,Nothing extra to add. ,Discussing with various stakeholders about issues and trying to find out information that is needed to problem solve if it is not presented to me.,"1,2,6,8,17",25,20,,,,10,,10,,,,,,,,,35,,,,,,,,,,,,,,,,,,,,,,,,,,,,,,,,,,,,,,,,,,,,,,,,,,,,,,,,,,Solving problems around the supply chain and reocurring supplier compliance issues by utilising help from different stakeholders and delegating to teams what work and actions are needed.,"1,5,6,8,13",25,,,,13,12,,30,,,,,20,,,,,,,,,,,,,,,,,,,,,,,,,,,,,,,,,,,,,,,,,,,Sending emails and messages to colleagues and suppliers. ,"2,3,5,6,7",,20,30,,20,10,20,,,,,,,,,,,"Talking to different internal stakeholders about issues, planning meetings, discussing these issues in meeting and determining action plans.","1,2,11,14,17",15,20,,,,,,,,,25,,,20,,,20,Talking to different internal and external stakeholders to build relationships and be able to call upon them when we need support as a team.,"10,11,12,15,17",,,,,,,,,,15,10,20,,,25,,30,,,,,,,,,,,,,,,,,,,,,,,,,,,,,,,,,,,,,,,,,,,,,,,,,,,,,,,,,,,,,,,,,,,,,,,,,,,,,,,,,,,,,,,,,,,,,,,,80,100,90,,60,70,20,20,I would have thought its purpose was to determine how people think about the various tasks they carry out on a day to day basis and how different cognitive and physical functions impact the way they work and think about their actions and their impact on others.,1,1,1,1,3,1
R_7Mu1Y55PSoPpPVJ,6632c5d854799acad3f37450,Director of Operations,Spectrum Controls,"Design and manufacture industrial automation modules. I manage the operations team, covering planning, purchasing, IT, manufacturing, shipping and receiving",4,4,4,"1,3,5,6,9",,,,2,,1,,4,5,,,3,,,,,,,10,,10,,5,5,,,5,,,,,,,0,,0,,0,0,,,20,,,,,,,20,,0,,40,40,,,100,,,,,,,90,90,95,Thanks,"Review, look up, search, create (eg daily output report) for the information needed. Use the available tools and then analyze that data (filter).","1,2,3,5,15",25,30,15,,15,,,,,,,,,,15,,,,,,,,,,,,,,,,,,,,,,"Mental ability, prior knowledge of what I am reviewing. Then forward thinking about what is the potential impact of this information. ","1,2,5,11,15",15,20,,,20,,,,,,25,,,,20,,,,,,,,,,,,,,,,,,,,,,"Understand the problem statement using procedural and episodic memory. Consult outside resources to get more information, communication and intuitive thinking. Brainstorm on possible solutions - planning, mental stimulation. Finalize on an option. Communicate that option and put it into practice. Review the results. ","3,5,8,13,17",,,10,,10,,,10,,,,,20,,,,50,"To outline the objectives, to sub-divide the overall goal into smaller tasks to get to that objective. To create timeline and milestones to track and observe. To communicate the new plan and milestones to the team. ","4,8,14,15,17",,,,10,,,,20,,,,,,10,10,,50,,,,,,,,,,,,,,,,,,,,,,,,,,,,,,,,,,,,,,,"Summarize the information in my head, Then draft/edit the communication delivery (email, face-to-face, report, presentation). Then deliver the message.","1,2,5,9,17",10,10,,,5,,,,25,,,,,,,,50,,,,,,,,,,,,,,,,,,,,,,,,,,,,,,,,,,,,,,,,,,,,,,,,,,,,,,,,,,,,,,,,,,,,,,,,,,,,,,,,,,,,,,,,,,,,,,,,,,,,,,,,,,,,,,,,,,,90,90,95,Interesting work and questionnaire. I enjoyed this questionnaire.,80,90,10,10,Understanding a little about different cognitive skills and when are they used in day-to-day work environments,1,1,1,1,1,1
R_80CKBSKnq60mQvj,6658b14f04e819e67ebcf3ff,manager,warehousing transportation,"Management, managing a team of 6. Often work from home. Over seeing the logistics and transportation of goods. ",6,6,4,"2,5,8,9,11",,,,,4,,,2,,,5,3,,1,,,,,,10,,,7,,,4,1,,10,,,,,,58,,,9,,,60,41,,81,,,,,,59,,,80,,,21,100,,100,,,,,100,99,100,"Great survey, clear and easy to navigate.",,,,,,,,,,,,,,,,,,,,"Performance , sales , growth , customer satisfaction. ","8,9,10,14,17",,,,,,,,25,5,30,,,,20,,,20,,,,,,,,,,,,,,,,,,,,,,,,,,,,,,,,,,,,,,,collect information to identify areas of improvement.  identify challenges. research and involve the team. ,"6,7,8,10,17",,,,,,25,15,15,,15,,,,,,,30,,,,,,,,,,,,,,,,,,,,,,,,,,,,,,,,,,,,,,,"Communicating with staff and customers \ services. Business goals, projects and planning. Making sure deadlines are met.","8,9,14,15,17",,,,,,,,25,10,,,,,25,10,,30,Deadlines and goals.,"1,5,8,15,17",5,,,,5,,,30,,,,,,,30,,30,,,,,,,,,,,,,,,,,,,,"Communication , feedback , staff training.","6,8,10,15,17",,,,,,15,,10,,25,,,,,30,,20,,,,,,,,,,,,,,,,,,,,,,,,,,,,,,,,,,,,,,,,,,,,,,,,,,,,,,,,,,,,,,,,,,,,,,,,,,,,,100,100,100,"none, very clear and easy to use.",99,99,0,0,"tasks , roles, abilities in the workplace.",1,1,1,1,1,1
R_8PZdPEKW6MXoCYr,65de12a7fcbc6ef9331bcc98,Office Manager,A gardening company,"Managing the office, accounts and admin based activities of the company.",6,8,4,"3,6,8,9,12",,,,,,3,,,5,,1,4,,,2,,,,,,6,,,4,,6,2,,,2,,,,,,0,,,0,,0,7,,,1,,,,,,9,,,20,,3,41,,,21,,,,68,84,49,,,,,,,,,,,,,,,,,,,,,,,,,,,,,,,,,,,,,,,,Producing the quarterly VAT returns.,"2,3,4,5,7",,10,50,10,10,,20,,,,,,,,,,,,,,,,,,,,,,,,,,,,,,,,,,,,,,,,,,,,,,,,,Organising the work rota for the coming weeks.,"5,7,8,12,15",,,,,20,,10,40,,,,10,,,20,,,,,,,,,,,,,,,,,,,,,,Using the accounting software package as well as Office 365.,"2,3,5,13,14",,10,50,,20,,,,,,,,10,10,,,,Communicating with the team to relay any changes to schedules as well as communicating with customers regarding visits and invoicing.,"5,10,11,12,17",,,,,20,,,,,10,20,20,,,,,30,,,,,,,,,,,,,,,,,,,,,,,,,,,,,,,,,,,,,,,I am responsible for invoicing according to work carried out and also sundries used to complete the work.  I am also responsible for stock taking.,"2,3,4,5,6",,30,30,10,20,10,,,,,,,,,,,,,,,,,,,,,,,,,,,,,,,,,,,,,,,,,,,,,,,,,,,,,,,,,,,,,,,,,,,,,70,91,61,,60,61,31,31,Working out how easily my job could be replaced by AI.,2,1,2,1,1,1
R_2nIPUrCiJ58u1Bm,651abfde6598a7443132c95b,Information Governance Manager,University,"I work in the data protection team, assessing new projects and initiatives and their compliance with UK GDPR.  In a wider context I work in the our IT department, and mainly deal with new IT projects.",2,2,4,"1,5,8,9,10",,,,4,,,,3,,,5,1,2,,,,,,5,,,,10,,,30,20,5,,,,,,10,,,,10,,,10,10,10,,,,,,30,,,,23,,,30,80,90,,,,,,90,80,100,"Nothing, thank you.",Reading and researching information on the relevant legislation and recalling past practice.,"1,2,8,14,17",10,30,,,,,,10,,,,,,30,,,20,,,,,,,,,,,,,,,,,,,,,,,,,,,,,,,,,,,,,,,,,,,,,,,,,,,,,,,,,,"Reading reports, identifying issues and them making recommendations to improve systems and processes.","2,8,13,15,17",,10,,,,,,20,,,,,10,,20,,40,,,,,,,,,,,,,,,,,,,,,,,,,,,,,,,,,,,,,,,"Using email, undertaking virtual meetings, dealing with documents and electronic filing.","1,3,13,14,15",20,,20,,,,,,,,,,20,30,10,,,This would involve writing to individuals via email or communication with them in person or in virtual meetings. ,"1,2,7,8,17",10,30,,,,,10,20,,,,,,,,,30,"Communicating your decisions to others, working with them to reach a decision. Understanding individuals motivations when working with them. Meeting people in person to discuss issues, rather than via email.","7,9,11,15,17",,,,,,,20,,20,,20,,,,10,,30,,,,,,,,,,,,,,,,,,,,,,,,,,,,,,,,,,,,,,,,,,,,,,,,,,,,,,,,,,,,,,,,,,,,,,,,,,,,,,,,,,,,,,,,,,,,,,,,100,100,70,"No, it was fine!",80,80,30,30,I would have thought it would be about what mental skills are required to undertake different types of work?,1,1,1,1,1,1
R_6LHBq5XDMyhN1bs,66063e30b927403afa9cc13f,IT Salesforce Support,National Bank of Canada,"I work within the IT department, where i support salesforce and all employees of the organisation with any issues they may experience. I work on support tickets daily and help to integrate our employees and the system so it works flowingly",3,10,4,"3,5,6,8,9",,,,,,4,,2,3,,1,5,,,,,,,,,10,,5,5,,15,5,,,,,,,,,9,,9,14,,20,11,,,,,,,,,5,,38,69,,42,72,,,,,,,61,70,69,it is a good survey,,,,,,,,,,,,,,,,,,,,,,,,,,,,,,,,,,,,,,,Analyse IT issues to see if there is a common corrolation and a better way of completing the task more efficently ,"2,7,13,15,17",,20,,,,,20,,,,,,20,,20,,20,,,,,,,,,,,,,,,,,,,,Team meetings where we make decisions and plan ahead for the forthcoming quarter,"2,4,8,13,17",,30,,10,,,,20,,,,,20,,,,20,"We have quarterly meetings where we plan and organise the current workload coming up, for the next 4 months","7,8,12,14,17",,,,,,,20,20,,,,20,,20,,,20,,,,,,,,,,,,,,,,,,,,"communicating with colleagues on a day to day basis, having meetings. and also using a computer to complete support tickets","3,8,9,10,17",,,20,,,,,20,20,20,,,,,,,20,Communicating with colleagues and other employees that have issues with IT,"2,11,12,14,17",,20,,,,,,,,,20,20,,20,,,20,,,,,,,,,,,,,,,,,,,,,,,,,,,,,,,,,,,,,,,,,,,,,,,,,,,,,,,,,,,,,,,,,,,,,,,,,,,,,,,,,,,,,,,,,,,,,,,,,,,,,,,,,,,,,,,,,,,88,89,77,,88,89,43,43,To see how and what kind of tasks we perform in our daily lives,2,3,1,2,1,1
R_5gjuDvRvPaorUDB,62db5bbcd9f474c0264b50ca,Order Support,Best Buy,I work on client orders to assure they remain healthy and are completed on a timely basis.,3,17,4,"1,3,5,8,9",,,,3,,1,,2,,,4,5,,,,,,,20,,10,,5,,,4,1,,,,,,,0,,0,,0,,,0,0,,,,,,,0,,0,,0,,,0,76,,,,,,,100,100,100,,Some activites that relate to finding out information is doing research and seeking various sources to get a better understanding on what the situation is.,"2,3,4,5,8",,20,20,20,20,,,20,,,,,,,,,,,,,,,,,,,,,,,,,,,,,Analysing data or working with numbers mean looking at various numerical information and using it to better understand our business results.,"4,5,8,14,15",,,,20,20,,,20,,,,,,20,20,,,,,,,,,,,,,,,,,,,,,,Making decisions or solving problems mean making choices that can impact our business and give a desired result.,"5,7,13,14,17",,,,,20,,20,,,,,,20,20,,,20,,,,,,,,,,,,,,,,,,,,,,,,,,,,,,,,,,,,,,,Using computers or working with technology mean using our work laptop as a tool to function at our job.,"1,4,8,10,12",20,,,20,,,,20,,20,,20,,,,,,Communicating information to others mean relaying information to my peers so that we can properly work towards our business goals.,"1,2,10,13,17",20,20,,,,,,,,20,,,20,,,,20,,,,,,,,,,,,,,,,,,,,,,,,,,,,,,,,,,,,,,,,,,,,,,,,,,,,,,,,,,,,,,,,,,,,,,,,,,,,,,,,,,,,,,,,,,,,,,,,,,,,,,,,,,,,,,,,,,,39,20,61,,50,50,100,100,,1,1,1,1,1,1
