R_8PsCF4prERquqv8,6676d03047a5427aa847c276,Business Director,Wavemaker,I work in advertising as a business director. I am the main point of contact for our clients and also responsible for project managing various specialists.,0,12,5,"2,5,6,9,10",,,,,5,,,3,4,,,2,1,,,,,,,3,,,2,10,,,12,10,,,,,,,1,,,0,0,,,0,0,,,,,,,0,,,0,80,,,100,100,,,,,,84,95,93,,,,,,,,,,,,,,,,,,,,,Quality control of outputs that go to the client,"5,7,10,14,15",,,,,25,,15,,,15,,,,25,20,,,,,,,,,,,,,,,,,,,,,,,,,,,,,,,,,,,,,,,,,"Having to decide which of several options is the best option for my client, resolving any issues that come up e.g. finance queries","2,3,7,8,14",,15,30,,,,5,30,,,,,,20,,,,"Planning my tasks for the day, ensuring regular tasks are done on time etc","2,3,4,7,9",,20,25,40,,,10,,5,,,,,,,,,,,,,,,,,,,,,,,,,,,,,,,,,,,,,,,,,,,,,,,"Delegating tasks to team members, explaining to clients what proposals mean","8,10,11,13,17",,,,,,,,5,,20,10,,5,,,,60,"Delegating tasks to team members, speaking to clients about what they need","1,10,11,15,17",15,,,,,,,,,30,30,,,,5,,20,,,,,,,,,,,,,,,,,,,,,,,,,,,,,,,,,,,,,,,,,,,,,,,,,,,,,,,,,,,,,,,,,,,,,,,,,,,,,,,,,,,,,,,,,,,,,,,,97,96,96,,78,78,83,68,what skills are needed for each element of our roles,3,1,1,1,1,1
R_6Nst5ycbGFVQd2h,65cabaacf0080c56c143ce38,Senior Account Manager,Skyword,Manage content strategy for multiple clients in various industries. The organization I work for is a content marketing agency. ,3,6,5,"1,3,4,9,10",,,,3,,2,4,,,,,5,1,,,,,,9,,12,11,,,,,3,5,,,,,,0,,0,0,,,,,0,0,,,,,,20,,6,31,,,,,94,100,,,,,,100,100,89,,"I often have to research emerging competitor trends for clients to consider in their content. Additionally, I typically need to gather research and information from the clients themselves in order to tailor our projects to their needs. ","2,3,4,5,17",,25,20,10,30,,,,,,,,,,,,15,,,,,,,,,,,,,,,,,,,,"On a quarterly basis, I must create a report based on various performance analytics. I regularly pull website and google search data to identify trends and patterns that can help us make future decisions. ","3,5,6,8,14",,,30,,20,20,,15,,,,,,15,,,,"Being in content strategy, I often have to ideate theme and topics for our clients to write about. ","2,3,4,5,11",,20,20,15,15,,,,,,30,,,,,,,,,,,,,,,,,,,,,,,,,,,,,,,,,,,,,,,,,,,,,,,,,,,,,,,,,,,,,,,,,,,,,,,,,,,,,,,,,,,"Updating my supervisor, making requests, and reporting to clients. ","1,2,5,11,17",15,15,,,10,,,,,,10,,,,,,50,"Account management requires the trust of our clients. Additionally, I work very closely with members of different departments of my organization to ensure cross-functional harmony.","2,10,11,15,17",,15,,,,,,,,10,20,,,,15,,40,,,,,,,,,,,,,,,,,,,,,,,,,,,,,,,,,,,,,,,,,,,,,,,,,,,,,,,,,,,,,,,,,,,,,,,,,,,,,,,,,,,,,,,,,,,,,,,,100,100,95,,50,50,74,76,If employees understand their working styles. ,1,1,1,1,1,1
R_2iOaNHOOuFxxhgv,57df427c722df500017f43ae,writer,publisher,"I write, edit, proofread and publish fiction and non-fiction books.",13,13,5,"2,4,5,8,9",,,,,3,,2,4,,,5,1,,,,,,,,10,,2,15,,,40,5,,,,,,,,0,,1,1,,,8,0,,,,,,,,20,,0,20,,,10,50,,,,,,,91,100,69,It has a nice layout. I appreciate the completion line at the bottom.,,,,,,,,,,,,,,,,,,,,I judge so I can edit out what doesn't fit the content. I judge covers and pictures to see if they suit the written content.,"8,10,11,15,17",,,,,,,,40,,15,15,,,,25,,5,,,,,,,,,,,,,,,,,,,,I brainstorm possible ideas I can write about. I think about different book cover and picture designs to suit the written work.,"2,4,5,7,8",,20,,20,28,,2,30,,,,,,,,,,I have to decide which book or article to write first depending on possible income generation. I have to figure out why certain words or paragraphs don't fit the content.,"1,4,8,13,15",10,,,15,,,,35,,,,,35,,5,,,,,,,,,,,,,,,,,,,,,,,,,,,,,,,,,,,,,,,,,Writing and editing involves typing on computers. Editing book covers requires computers with editing software.,"4,6,7,9,17",,,,30,,10,10,,40,,,,,,,,10,Marketing books to customers through mailing lists and ads. Asking others for help on social media.,"2,4,5,11,17",,30,,25,5,,,,,,20,,,,,,20,,,,,,,,,,,,,,,,,,,,,,,,,,,,,,,,,,,,,,,,,,,,,,,,,,,,,,,,,,,,,,,,,,,,,,,,,,,,,,,,,,,,,,,,,,,,,,,,,,,,,,,,,,,,,,,,,,,100,100,90,The progress bar seems backloaded. It jumped a lot at the start and made it seem like the study was almost over.,0,0,100,100,To see if every job can fit into certain work descriptions if we are forced to think about it.,1,1,1,1,1,1
R_6jvRFcyO3sV8LeJ,666a1eb61d6ab318e46739a8,Sales manager,RER Motorsports,I am a sales manager for RER Motorsports selling car parts on eBay.,2,17,5,"1,4,6,8,10",,,,2,,,3,,4,,1,,5,,,,,,5,,,5,,10,,20,,5,,,,,,65,,,70,,76,,95,,66,,,,,,24,,,29,,65,,43,,100,,,,,,100,100,100,,Sourcing new products for inventory.,"2,3,4,5,10",,20,25,15,30,,,,,10,,,,,,,,,,,,,,,,,,,,,,,,,,,,,,,,,,,,,,,,,,,,,,Coming up with new products to sell that have decent profit margins.,"1,8,11,13,15",20,,,,,,,20,,,20,,20,,20,,,,,,,,,,,,,,,,,,,,,,Organizing inventory into different categories for an easy way to check inventory levels.,"2,5,8,9,15",,15,,,15,,,20,20,,,,,,30,,,,,,,,,,,,,,,,,,,,,,Using my computer to source new products.,"2,5,9,13,14",,20,,,20,,,,20,,,,20,20,,,,,,,,,,,,,,,,,,,,,,,Developing relationships with new product vendors.,"2,6,9,10,15",,20,,,,20,,,20,20,,,,,20,,,,,,,,,,,,,,,,,,,,,,,,,,,,,,,,,,,,,,,,,,,,,,,,,,,,,,,,,,,,,,,,,,,,,,,,,,,,,,,,,,,,,,,,,,,,,,,,,,20,21,70,Less writing would be nice.,50,20,20,40,different types of mental thinking processes,2,1,2,1,1,1
R_5IWRXYN0e3Wch1Z,5e7bc6522b3c381f6e3c1b3f,Business development rep,Fraktals,Reach out to potential clients and set up meeting to discuss partnership,0,0,5,"1,2,8,9,10",,,,3,1,,,,,,4,2,5,,,,,,5,5,,,,,,15,7,8,,,,,,1,1,,,,,,41,12,2,,,,,,20,45,,,,,,1,76,98,,,,,,99,99,97,cool survey,qualify leads; research potential prospects,"2,4,5,7,8",,15,,15,50,,10,10,,,,,,,,,,qualify leads,"5,7,10,11,17",,,,,20,,20,,,10,10,,,,,,40,,,,,,,,,,,,,,,,,,,,,,,,,,,,,,,,,,,,,,,,,,,,,,,,,,,,,,,,,,,,,,,,,,,,,,,,,,,,,,,,,,,,,,,,,,,,,,,,email writing; linkedin outreach; zoom setup; CRM update,"3,4,7,8,17",,,5,20,,,5,20,,,,,,,,,50,cold-call prospects; inform value proposition; handle objection,"2,5,7,13,17",,20,,,10,,10,,,,,,10,,,,50,warm up clients to set meeting; keep in touch during sales process,"5,8,10,14,17",,,,,10,,,10,,20,,,,10,,,50,,,,,,,,,,,,,,,,,,,,,,,,,,,,,,,,,,,,,,,,,,,,,,,,,,,,,,,,,,,,,,,,,,,,,,,,,,,,,,,,,,,,,,,,,,,,,,,,89,82,85,none,30,56,10,16,skills and cognition for jobs,1,1,1,1,1,1
R_1Cr0cdxuLr321v8,6695485f783d3f0401e57897,Marketing Specialist,US Credit Bureau,"I am a Digital Marketing Specialist for a financial services company that specializes in Debt Consolidation, Credit Repair, and Timeshare Exit. My role is to manage websites and social media belonging to the company by creating content (social media posts, copywriting, press releases) and managing backend tasks (SEO, WordPress design, comment moderation).",0,2,5,"1,4,6,8,9",,,,3,,,4,,5,,2,1,,,,,,,15,,,5,,10,,40,20,,,,,,,0,,,0,,10,,10,10,,,,,,,10,,,45,,50,,40,100,,,,,,,100,90,100,,"""Finding out information"" in the context of my job means learning about how people view the company by researching our reputation via reviews/discussion board conversations and keeping up with the competition by seeing what other companies are doing and whether they are doing something that we could benefit from adapting as well.","5,7,8,14,15",,,,,10,,5,10,,,,,,40,35,,,,,,,,,,,,,,,,,,,,,,,,,,,,,,,,,,,,,,,,,"""Coming up with new ideas"" in the context of my job means making sure we don't come across as repetitive by just re-posting the same context repeatedly. To accomplish this, my role highly encourages me to be kept up to the date with the latest industry news and trends.","2,7,14,15,17",,10,,,,,20,,,,,,,15,30,,25,,,,,,,,,,,,,,,,,,,,"""Planning or organizing work"" in the context of my job is to make sure I am optimizing my time to get the most amount of tasks done. For example, to maintain a good social media presence its important to plan ahead to ensure content is published daily and that the content is diverse enough to be both engaging to our current audience while drawing in new eyes as well.","4,7,8,14,17",,,,10,,,20,40,,,,,,15,,,15,,,,,,,,,,,,,,,,,,,,"""Using computers or working with technology"" in the context of my job is having working knowledge of using a computer (ex. knowing how to fix basic technical errors or setting up video/audio features) and online programs to create marketing material (ex. video editing software, website building/management tools, etc.)","3,4,9,13,15",,,45,25,,,,,15,,,,5,,10,,,"""Communicating information to others"" in the context of my job is creating content online that lets current, former, and potential clients know everything they need to know about financial hardships and that we are a reliable service for them to use in order to help them in their situation. ","1,2,8,14,17",5,20,,,,,,15,,,,,,10,,,50,,,,,,,,,,,,,,,,,,,,,,,,,,,,,,,,,,,,,,,,,,,,,,,,,,,,,,,,,,,,,,,,,,,,,,,,,,,,,,,,,,,,,,,,,,,,,,,,,,,,,,,,,,,,,,,,,,,90,85,95,,80,75,30,45,How to program AI to replicate a human's though processes when conducting professional working tasks.,1,1,3,1,1,1
R_5VwJs8WYFYHTrHt,66a27fea2b5ab9c4e74fe6ca,Marketing Manager ,Empower,"Retirement plan marketing for participants (B to C). I devise and implement strategies to help participants save more in their plans, invest wisely, and overall improve their financial health. I also create educational content. ",19,33,5,"1,4,5,6,9",,,,4,,,1,2,5,,,3,,,,,,,5,,,5,10,10,,,10,,,,,,,5,,,5,5,5,,,24,,,,,,,80,,,15,35,6,,,100,,,,,,,100,90,100,No specific feedback,"Researching marketing tactics and finding pertinent studies or data to guide my strategy or support my approach.

Hunting down answers to questions I'm asked by don't know.

Navigating processes I'm unfamiliar with. ","1,2,5,8,11",10,30,,,20,,,20,,,20,,,,,,,,,,,,,,,,,,,,,,,,,,,,,,,,,,,,,,,,,,,,,I come up with new ideas to improve AUA or other marketing outcomes for my organization. ,"8,13,14,15,17",,,,,,,,10,,,,,10,50,20,,10,I often get questions that are misdirected or encounter situations where I'm not sure how or who to approach to get something done.,"5,8,9,11,13",,,,,5,,,15,20,,30,,30,,,,,When starting a project that needs implementation I need to come up with a project plan with dates and phases to ensure in-time delivery,"2,3,5,8,11",,5,5,,20,,,50,,,20,,,,,,,,,,,,,,,,,,,,,,,,,,,,,,,,,,,,,,,,,,,,,"When it comes time to roll out a project, I need to present the strategy and rollout logistics to different audiences. I also need to respond to questions directed to my department. ","5,10,11,13,17",,,,,10,,,,,20,20,,20,,,,30,,,,,,,,,,,,,,,,,,,,,,,,,,,,,,,,,,,,,,,,,,,,,,,,,,,,,,,,,,,,,,,,,,,,,,,,,,,,,,,,,,,,,,,,,,,,,,,,,,,,,,,,,,,,,,,,,,,100,90,100,No suggestions ,50,50,20,20,Understanding cognitive function and its impact on different work responsibilities ,2,1,1,1,1,1
R_7Qs3doekqLHNzvv,6102f7a4a340c0eec430fbaa,Nonprofit Partnerships Representative,Benevity,"Benevity is a CSR company whose software empowers companies and their employees to do good. Through our software employees can volunteer, donate, give grants to and support nonprofits and the world in general with microactions.

My role is very similar to a BDR's - I work to obtain volunteering opportunities from nonprofits in the USA to promote on our platform. I prospect potential nonprofits, connect with them via phone and email, and upload obtained opportunities to our platform for clients to see and engage with.",2,2,5,"1,2,8,9,10",,,,1,4,,,,,,5,3,2,,,,,,10,6,,,,,,9,8,4,,,,,,0,0,,,,,,8,0,1,,,,,,1,1,,,,,,1,92,99,,,,,,100,100,100,,"I prospect opportunities from NPO websites, find out the main contact and their organizations mission, find out where their pain points are and get ready for calls/ to suggest activities they can submit.","5,6,7,8,10",,,,,10,10,15,15,,50,,,,,,,,"When prospecting an NPO to reach out to, I have to judge if it's worth it (do they have volunteering, are they in good standing, etc.) and judge the activities they send in (will this get engagement, is it worded well, etc.)","1,5,8,14,15",5,,,,20,,,50,,,,,,20,5,,,,,,,,,,,,,,,,,,,,,,,,,,,,,,,,,,,,,,,,,,,,,,,,,,,,,,,,,,,,,,,,,,,,,,,,,,,,,,,,,,,,,,,,,,,,,,,,,,"I have to upload volunteering opportunities onto our platform, edit them in the system, use Asana and Slack to communicate and track projects.","2,3,4,6,14",,30,45,10,,10,,,,,,,,5,,,,Explaining how our platform works to nonprofits and the process to get activities uploaded. Explaining Benevity and what we do.,"2,4,10,11,17",,25,,5,,,,,,15,5,,,,,,50,"When communicating with nonprofits, I build a relationship with them so they will continue to send in volunteering needs as they arise, and are excited about Benevity. I talk about their organization, their roles, their lives outside of work and what they're passionate about.","1,10,11,14,17",20,,,,,,,,,20,30,,,10,,,20,,,,,,,,,,,,,,,,,,,,,,,,,,,,,,,,,,,,,,,,,,,,,,,,,,,,,,,,,,,,,,,,,,,,,,,,,,,,,,,,,,,,,,,,,,,,,,,,100,100,100,,20,20,80,80,Seeing what traits AI needs to do various jobs well.,1,1,1,1,1,1
R_7CAIf4DaoDwtH2N,5be888a20e366e0001760376,Compensation Analyst,London Hospital,"I complete job evaluation tasks, market analysis of jobs within the hospital sector to ensure our organisations compensation structure aligns to our corporate philosophy and is competitive. 
The organisation is a large acute care teaching hospital with a small core compensation team. Compensation is a dynamic field as policy changes are frequent around pay equity and transparency.",1,3,5,"1,2,3,6,10",,,,2,4,1,,,5,,,,3,,,,,,10,6,8,,,8,,,,8,,,,,,2,1,0,,,0,,,,1,,,,,,50,0,0,,,40,,,,100,,,,,,99,80,96,the sliding scale bars are annoying to navigate,"online research for comparator jobs, meetings with leadership team and employees","2,5,10,11,17",,15,,,25,,,,,30,15,,,,,,15,"reading job descriptions, performing a job shadow","3,7,13,14,15",,,15,,,,15,,,,,,15,30,25,,,"comparing job evaluation results, analysing benchmarking review data","2,5,6,13,14",,15,,,25,20,,,,,,,20,20,,,,,,,,,,,,,,,,,,,,,,,,,,,,,,,,,,,,,,,,,,"scheduling, assigning work to others, reviewing calendar for upcoming meetings","6,8,11,13,15",,,,,,10,,25,,,15,,25,,25,,,,,,,,,,,,,,,,,,,,,,,,,,,,,,,,,,,,,,,,,,,,,,,,,,,,,,,,,,,,Networking,"2,9,10,11,17",,10,,,,,,,10,30,10,,,,,,40,,,,,,,,,,,,,,,,,,,,,,,,,,,,,,,,,,,,,,,,,,,,,,,,,,,,,,,,,,,,,,,,,,,,,,,,,,,,,,,,,,,,,,,,,,,,,,,,95,95,95,remove the sliding scale bars and replace with number fill in boxes,85,88,0,0,what qualities does a robot need to perform certain tasks at an assigned job,2,1,1,1,1,1
R_8FvSmPjYsBn7xqF,66742be70420121810222b02,HR Operations,A housing association.,"To be first point of contact for employee queries, write and administer contracts, handle offboarding procedures, manage inboxes, work with those of higher positions in employee grievances, complete testing for new `HR system updates, initiate updates for HR Systems, run reports and analyze data. I work for a not for profit housing association across the UK but mainly in the midlands and south. ",1,3,5,"1,5,8,9,12",,,,1,,,,4,,,2,3,,,5,,,,30,,,,20,,,35,25,,,20,,,,1,,,,0,,,8,1,,,1,,,,20,,,,30,,,0,89,,,0,,,,100,100,100,,"Finding out the information required to answer queries, whether this be from an employee perspective or from another team. ","2,3,5,7,17",,20,15,,30,,5,,,,,,,,,,30,,,,,,,,,,,,,,,,,,,,,,,,,,,,,,,,,,,,,,,,,,,,,,,,,,,,,,,,,,Solving the problem that an employee/team member comes to me with.,"2,5,8,13,17",,20,,,10,,,30,,,,,20,,,,20,,,,,,,,,,,,,,,,,,,,,,,,,,,,,,,,,,,,,,,"I use a computer for my entire job, sending emails, thinking of new ways of working in relation to the HR online portal, testing the portal, onboarding new employees to the portal, drafting contracts, using reports/spreadsheets.","2,3,5,6,17",,30,30,,10,10,,,,,,,,,,,20,When answering emails/queries,"2,3,5,6,17",,20,20,,20,20,,,,,,,,,,,20,,,,,,,,,,,,,,,,,,,,,,,,,,,,,,,,,,,,,,,Storing employee data,"2,3,5,6,17",,20,20,,20,20,,,,,,,,,,,20,,,,,,,,,,,,,,,,,,,,,,,,,,,,,,,,,,,,,,,,,,,,,,,,,,,,,,,,,,90,100,99,,90,90,5,6,The skills required to complete a job and how these relate to the various elements that make up the brain/memory,2,3,1,1,1,1
R_3dSXGOKIvVEZw3w,668e8d211e3fa4b1db322490,Employee Relations Manager,Amazon,"As an Employee Relations Manager, I evaluate company data to identify trends and defects in the employee experience.  I assist leadership with understanding these trends and developing strategies to improve the employee experience.  I also ensure that leaders are implementing changes that comply with legislative requirements.",2,14,5,"2,3,5,6,9",,,,,3,1,,2,4,,,5,,,,,,,,7,10,,10,10,,,15,,,,,,,,0,0,,0,0,,,0,,,,,,,,80,50,,80,21,,,100,,,,,,,100,100,100,No feedback at the moment.,,,,,,,,,,,,,,,,,,,,"I function as a guardrail to ensure that business decisions are complying with legislative requirements and have minimal impact to the employee experience.  For example, I review all proposed changes and communications that could significant impact employees.","1,5,6,8,15",25,,,,20,20,,10,,,,,,,25,,,I review metrics across different dashboards to identify themes and trends that might describe employee sentiment regarding a range of topics,"2,3,5,11,13",,15,10,,20,,,,,,15,,40,,,,,,,,,,,,,,,,,,,,,,,,I have to exercise a high degree of judgment to assess ambiguous situations and identify the appropriate path forward to best support a fast-moving business,"1,5,7,9,15",20,,,,15,,25,,15,,,,,,25,,,"As time is limited and demands are frequent every day, I must plan my day in a way to ensure that I have time to move my projects forward while allowing for flexibility to respond to ad hoc requests.","2,3,4,7,8",,15,15,20,,,20,30,,,,,,,,,,,,,,,,,,,,,,,,,,,,,,,,,,,,,,,,,,,,,,,,I regularly advise stakeholders and partners of the appropriate path forward,"2,5,7,13,17",,20,,,20,,15,,,,,,15,,,,30,,,,,,,,,,,,,,,,,,,,,,,,,,,,,,,,,,,,,,,,,,,,,,,,,,,,,,,,,,,,,,,,,,,,,,,,,,,,,,,,,,,,,,,,,,,,,,,,,,,,,,,,,,,,,,,,,,,100,100,100,None really,100,100,100,100,I thought it was simply asking me to comment on the ways my memory is used in my line of work.,1,1,1,1,1,1
R_2w6qvfleEMdsFVL,6154d028075e05c122af454e,Estimating Manger ,Paramount Group ,I manage the estimating department within my company =,0,10,6,"3,5,6,8,9",,,,,,4,,1,2,,5,3,,,,,,,,,10,,10,10,,10,10,,,,,,,,,0,,0,0,,0,0,,,,,,,,,0,,68,74,,0,100,,,,,,,100,100,100,no issue ,,,,,,,,,,,,,,,,,,,,,,,,,,,,,,,,,,,,,,,I have to work out prices ,"2,3,4,5,10",,20,10,10,50,,,,,10,,,,,,,,,,,,,,,,,,,,,,,,,,,I have to make decisions regarding what order to do work in ,"1,2,6,7,17",10,30,,,,20,20,,,,,,,,,,20,I have to plan what tenders need to be sent out in each day to meet deadlines,"2,4,8,9,13",,20,,30,,,,20,20,,,,10,,,,,,,,,,,,,,,,,,,,,,,,I have to input data into the computer ,"1,2,4,7,9",20,20,,20,,,20,,20,,,,,,,,,I have to speak with sales people to make sure we are on the same page ,"2,3,5,6,7",,40,10,,30,10,10,,,,,,,,,,,,,,,,,,,,,,,,,,,,,,,,,,,,,,,,,,,,,,,,,,,,,,,,,,,,,,,,,,,,,,,,,,,,,,,,,,,,,,,,,,,,,,,,,,,,,,,,,,,,,,,,,,,,,,,,,,,,,100,100,100,No improvement ,100,100,14,13,Building a robot to do my job,1,1,1,1,1,1
R_2MWFJbwfkRvFA1X,60cd16e63d3924958e8d3d43,healthcare assistant,HSE,i assist patients with there activities of daily living,15,15,6,"5,6,8,9,12",,,,,,,,3,2,,5,1,,,4,,,,,,,,10,5,,5,15,,,10,,,,,,,,100,100,,89,100,,,100,,,,,,,,100,100,,85,100,,,100,,,,100,100,100,everything went well,,,,,,,,,,,,,,,,,,,,,,,,,,,,,,,,,,,,,,,,,,,,,,,,,,,,,,,,,,,,,,,,,,,,,,,,,,,,,i make decisions with other team members in relation to patient care,"1,3,7,14,15",20,,20,,,,20,,,,,,,20,20,,,i plan day to day tasks in relation to patient care,"2,5,10,15,17",,20,,,20,,,,,20,,,,,20,,20,,,,,,,,,,,,,,,,,,,,i use computer to document information about patient care,"1,5,8,13,15",20,,,,20,,,20,,,,,20,,20,,,i make decisions with other team members in relation to patient care,"1,5,8,15,17",20,,,,20,,,20,,,,,,,20,,20,,,,,,,,,,,,,,,,,,,,,,,,,,,,,,,,,,,,,,,uploading information on patients care files using computer,"2,8,10,11,17",,20,,,,,,20,,20,20,,,,,,20,,,,,,,,,,,,,,,,,,,,,,,,,,,,,,,,,,,,,,,,,,,,,,,,,,,,,,,,,,100,100,100,everything went well,100,47,42,45,what memory your using,1,1,1,1,1,1
R_5jvbfCvNOBtpqtf,5e2f8227b9a45e53a411f373,Social Worker,Hamilton Hospital,I provide counselling and referrals to hospital patients. ,7,9,6,"1,5,9,10,12",,,,3,,,,4,,,,2,1,,5,,,,7,,,,7,,,,7,7,,7,,,,12,,,,10,,,,12,13,,5,,,,100,,,,63,,,,100,99,,20,,,,100,100,100,Not applicable,Trying to pick up verbal and non verbal cues to have a full understanding of the situation.,"5,9,13,15,17",,,,,10,,,,20,,,,50,,10,,10,,,,,,,,,,,,,,,,,,,,,,,,,,,,,,,,,,,,,,,,,,,,,,,,,,,,,,,,,,Providing guidance or making referrals for a client.,"2,5,8,14,17",,10,,,10,,,50,,,,,,20,,,10,,,,,,,,,,,,,,,,,,,,,,,,,,,,,,,,,,,,,,,,,,,,,,,,,,,,,,,,,,Communicating effectively in a way that the individual will best receive the information.,"1,5,9,13,17",10,,,,10,,,,10,,,,10,,,,60,"In order to assist clients I have to develop professional relationships with respect, kindness but also be able to push back.","1,10,11,13,17",10,,,,,,,,,10,20,,10,,,,50,,,,,,,,,,,,,,,,,,,,Ensuring all important information is documented so that reason for contact and outcome are transparent. ,"2,3,4,13,17",,30,10,10,,,,,,,,,10,,,,40,,,,,,,,,,,,,,,,,,,,,,,,,,,,,,,,,,,,,,,,,,,,,,,,,,,,,,,,,,100,100,100,,50,51,50,50,Skills necessary for building a robot. ,2,1,1,1,1,1
R_8n1NWVyIybRV7CL,6483648c280beabafcb3797e,Teacher,State funded school,"I work for a large multisite organisation. I plan, deliver and assess alevel content to students aged 16-19.",17,26,6,"2,6,9,10,11",,,,,5,,,,3,,,2,4,1,,,,,,10,,,,5,,,15,15,25,,,,,,8,,,,9,,,19,20,20,,,,,,80,,,,29,,,100,100,100,,,,,90,90,90,,,,,,,,,,,,,,,,,,,,,Question and answer session,"1,2,3,8,14",5,40,5,,,,,20,,,,,,30,,,,,,,,,,,,,,,,,,,,,,,,,,,,,,,,,,,,,,,,,,,,,,,,,,,,,,,,,,,,,Lesson planning in order to pass on content and build skills  ,"1,3,4,7,8",20,,15,5,,,10,50,,,,,,,,,,,,,,,,,,,,,,,,,,,,,,,,,,,,,,,,,,,,,,,,Using simpliistic language to break down diffcult concepts. Regular checking that the method of communication is effective in getting accross the information,"1,10,11,15,17",20,,,,,,,,,25,25,,,,10,,20,Get to know the learners and build trust. Share my own experiences and stories with them,"9,10,11,15,17",,,,,,,,,5,20,30,,,,15,,30,The passing on of information in a format that they can understand by showing thir understanding  ,"2,5,7,9,17",,40,,,10,,5,,5,,,,,,,,40,,,,,,,,,,,,,,,,,,,,,,,,,,,,,,,,,,,,,,,,,,,,,,,,,,,,,,,,,,,,,,,,,,,,,,,,,,,,,90,90,90,,70,70,0,0,n/A,1,1,1,1,1,2
R_8WJBVEBCXOo0rWH,6061ef11da123a1d9e55c6c8,teacher,school,"primary school teacher, state school",2,15,6,"2,4,6,9,11",,,,,5,,3,,2,,,1,,4,,,,,,2,,15,,10,,,20,,1,,,,,,25,,33,,17,,,66,,25,,,,,,45,,58,,59,,,84,,63,,,,,55,60,50,,,,,,,,,,,,,,,,,,,,,"When markin work, judging whether the child has understood new concepts or skills","1,2,3,5,17",5,35,20,,30,,,,,,,,,,,,10,,,,,,,,,,,,,,,,,,,,Planning engaging and well thought out tasks and activities for lessons,"8,11,14,15,17",,,,,,,,60,,,10,,,10,10,,10,,,,,,,,,,,,,,,,,,,,Preparing lessons and activities for children; preparing the work over the next year and developing a curriculum,"5,7,8,9,17",,,,,10,,10,65,10,,,,,,,,5,,,,,,,,,,,,,,,,,,,,,,,,,,,,,,,,,,,,,,,Teaching children knowledge and allowing them to develop skills; relaying information to colleagues to allow them to perform their own duties,"2,3,7,8,11",,10,20,,,,20,40,,,10,,,,,,,,,,,,,,,,,,,,,,,,,,Supporting colleagues who work alongside me; disseminating information to other staff,"2,3,5,8,17",,5,10,,10,,,15,,,,,,,,,60,,,,,,,,,,,,,,,,,,,,,,,,,,,,,,,,,,,,,,,,,,,,,,,,,,,,,,,,,,,,,,,,,,,,,,,,,,,,,59,66,77,,32,31,52,48,How AI may be used in the future to accomplish certain tasks,1,1,2,1,1,1
R_2hB0xVsXrHTHLNG,6658bcdeee0559730099503b,Teaching Assistant,Education,"Supporting teachers by helping with the classroom management, helping SEN kids as well, teaching phonics, providing individual help to students, and preparing materials for lessons",0,2,6,"1,5,6,10,12",,,,4,,,,1,3,,,,2,,5,,,,3,,,,4,6,,,,8,,4.5,,,,73,,,,69,100,,,,100,,72,,,,100,,,,100,71,,,,100,,47,,,,79,100,52,-,"Researching educational resources, gathering details about student's needs, and checking for updates on lesson plans or school policies. This ensures you have the necessary knowledge to support teachers and students effectively. ","2,3,5,7,11",,15,20,,20,,25,,,,20,,,,,,,,,,,,,,,,,,,,,,,,,,,,,,,,,,,,,,,,,,,,,,,,,,,,,,,,,,,,,,,,"Addressing student issues, safeguarding, adapting lesson plans to meet individual needs, and finding solutions to classroom challenges. ","5,8,10,12,15",,,,,25,,,25,,20,,10,,,20,,,"Creating schedules for classroom activities, preparing lesson materials in advance and coordinating with teachers to ensure a smooth flow of daily lessons and tasks. ","2,6,9,11,15",,20,,,,20,,,15,,25,,,,20,,,,,,,,,,,,,,,,,,,,,,,,,,,,,,,,,,,,,,,,,,,,,,,,,,,,,,,,,,,,Working with teachers and communicating with parents to support student's success. ,"2,5,11,12,14",,15,,,20,,,,,,25,10,,30,,,,,,,,,,,,,,,,,,,,,,,"Keeping track of student progress, maintaing records of assignments and assessments, and ensuring that classroom materials and resources are used efficiently and effectively. ","3,4,8,11,14",,,15,15,,,,25,,,25,,,20,,,,,,,,,,,,,,,,,,,,,,,,,,,,,,,,,,,,,,,,,,,,,,,,,,,,,,,,,,,,,49,39,72,-,49,32,0,0,I would have thought it was about assessing different cognitive and self-regulation skills. ,1,1,1,1,1,1
